hypothesis_norm	count	example_hypothesis	example_eval_config	example_perturbation	best_train_corpus	best_tfidf_similarity	best_similarity_class	best_train_text
she married her business partner stephen lee	5	she married her business partner stephen lee	base	onset_noise_amp0.05_dur0.5	rr_64pct	0.39963501914244315	novel_or_generic	And you married her.
benim yan mda kapal oturman za gerek yok ba n z a abilirsiniz	5	benim yanımda kapalı oturmanıza gerek yok başınızı açabilirsiniz	base	onset_noise_amp0.05_dur0.5	clean	0.4191135289378143	novel_or_generic	He married He Liliang in Yan'an.
his other film roles include whodunnit	5	his other film roles include whodunnit	base	onset_noise_amp0.05_dur0.5	ru_64pct	0.4664628062189401	weak_overlap	"Other roles include the series ""Hooperman"" and ""Cop Rock""."
also in allen park is the relocated tom hollins house	5	also in allen park is the relocated tom hollins house	base	onset_noise_amp0.05_dur0.5	clean	0.3879993215311299	novel_or_generic	Park is trilingual.
de castillo is a village in navarra	5	de castillo is a village in navarra	base	onset_noise_amp0.05_dur0.5	clean	0.5473141795712668	weak_overlap	Salvador Do Mundo is a village in Goa.
mozdrukeen was officially married three times	5	mozdrukeen was officially married three times	base	onset_noise_amp0.05_dur0.5	clean	0.7722045304715561	strong_overlap	Young married three times.
macken argue against animal rights in his widely reprinted paper do animals have rights	5	macken argue against animal rights in his widely reprinted paper do animals have rights	base	onset_noise_amp0.05_dur0.5	clean	0.25553288933196416	novel_or_generic	Favoured lyrical concerns included animal rights, conformity and science fiction.
president nicholas maduro condemned the protest actions	5	president nicholas maduro condemned the protest actions	base	onset_noise_amp0.05_dur0.5	rr_64pct	0.30998517683706117	novel_or_generic	No major opposition to the protest occurred.
the town s oldest secular building the old crown is there	5	the town s oldest secular building the old crown is there	base	onset_noise_amp0.05_dur0.5	ru_64pct	0.23069729509259584	novel_or_generic	Taza National Park is there.
might others within your organization have some inklings as to their desire	5	might others within your organization have some inklings as to their desire	base	onset_noise_amp0.05_dur0.5	clean	0.796530021674927	strong_overlap	Might others within your organisation have some inkling as to their desires?
it gives strawberries so you would not like it	5	it gives strawberries so you would not like it	base	onset_noise_amp0.5_dur0.5	clean	0.2954377419962193	novel_or_generic	Like, 'It's over!
they could no longer support the mirror	5	they could no longer support the mirror	base	onset_noise_amp0.5_dur0.5	ru_64pct	0.5123375438746025	weak_overlap	They paused no longer.
she looks at us she is going to come too	5	she looks at us she is going to come too	base	onset_noise_amp0.75_dur0.5	ru_64pct	0.47419050827426124	weak_overlap	He is going to open it.
are the consequences more humanistic or anti humanistic	5	are the consequences more humanistic or anti humanistic	base	reverb_amp0.5_dur0.5	ru_64pct	0.3236746747602697	novel_or_generic	Adoption as a theological term introduces a relational dimension to the consequences of Salvation.
the wind is now coming from the north east side of the city centre in the north east side of the city centre in the north east side of the city centre in the north east side of the city centre in the north east side of the city centre in the north east side of the city centre in the north east side of the city centre in the north east side of the city centre in the north east side of the city centre in the north east side of the city centre in the north east side of the city centre in the north east side of the city centre in the north east side of the city centre in the north east side of the city centre in the north east side of the city centre in the north east side of the city centre in the north east side of the city centre in the north east side of the city centre in the north east side of the city centre in the north east side of the city centre in the north east side of the city centre in the north east side of the city centre in the north east side of the north east side of the north east side of the north east side of the	5	the wind is now coming from the north east side of the city centre in the north east side of the city centre in the north east side of the city centre in the north east side of the city centre in the north east side of the city centre in the north east side of the city centre in the north east side of the city centre in the north east side of the city centre in the north east side of the city centre in the north east side of the city centre in the north east side of the city centre in the north east side of the city centre in the north east side of the city centre in the north east side of the city centre in the north east side of the city centre in the north east side of the city centre in the north east side of the city centre in the north east side of the city centre in the north east side of the city centre in the north east side of the city centre in the north east side of the city centre in the north east side of the city centre in the north east side of the north east side of the north east side of the north east side of the	rr_64pct	full_noise_amp0.5_dur0.0	rr_64pct	0.5209595801317896	weak_overlap	The main bank is on the north-east side of the ditch.
i guess it s a neverending story	5	i guess it s a neverending story	rr_64pct	none	ru_64pct	0.6242572209980571	weak_overlap	It's cool-I guess.
municin means near the island	5	municin means near the island	rr_64pct	none	ru_64pct	0.4493525406663821	novel_or_generic	"The autonym means ""villager""."
he is currently a member of investment bank jaffrey s global senior advisory board	5	he is currently a member of investment bank jaffrey s global senior advisory board	rr_64pct	none	ru_64pct	0.4967817096573144	weak_overlap	Mitchell is currently a member of the InterAction Council.
originally the finale for the sixth season was promoted as a cliffhanger	5	originally the finale for the sixth season was promoted as a cliffhanger	rr_64pct	none	clean	0.347450272478643	novel_or_generic	For the sixth season, Margaret Cho and NeNe Leakes joined the panel.
have you met kathryn	5	have you met kathryn	rr_64pct	none	clean	0.5566844356891225	weak_overlap	Have you a study?
de castillo is a village in novara	5	de castillo is a village in novara	rr_64pct	none	clean	0.5473141795712668	weak_overlap	Salvador Do Mundo is a village in Goa.
millen was primarily a second baseman	5	millen was primarily a second baseman	rr_64pct	none	ru_64pct	0.3364849568855791	novel_or_generic	Their music was primarily released on Southern Records.
this argument is ancient and must be in respect of economic policy	5	this argument is ancient and must be in respect of economic policy	rr_64pct	onset_noise_amp0.05_dur0.5	ru_64pct	0.29908396320118413	novel_or_generic	Tyagi and Haq are among the wounded and must be carried out.
the city is home to the city of canada and the city of canada is home to the city of canada	4	the city is home to the city of canada and the city of canada is home to the city of canada	base	full_noise_amp0.5_dur0.0	clean	0.46990818681420543	weak_overlap	The city is home to the Pine Bluff Arsenal.
lion rock is located northwest of wong tai singh	4	lion rock is located northwest of wong tai singh	base	onset_noise_amp0.05_dur0.5	ru_64pct	0.5186900963743092	weak_overlap	The district centre is Arghandab, located northwest of Kandahar.
women formed less than half of the group	4	women formed less than half of the group	base	onset_noise_amp0.05_dur0.5	clean	0.5469051365565012	weak_overlap	Less than half of the sphere can be projected onto a finite map.
this argument is ancient and must end in respects of economic policy	4	this argument is ancient and must end in respects of economic policy	base	onset_noise_amp0.05_dur0.5	ru_64pct	0.25171611609795885	novel_or_generic	The argument is subjective and might be considered specious.
the amino ablation property has a large number of correlation formulations	4	the amino ablation property has a large number of correlation formulations	base	onset_noise_amp0.05_dur0.5	ru_64pct	0.48734626001527226	weak_overlap	French Guiana also has a large number of Protestants.
crumple the spark else the flames will spread	4	crumple the spark else the flames will spread	base	onset_noise_amp0.05_dur0.5	clean	0.41289299998540996	novel_or_generic	The flames ignited the building and spread.
administratively they belong to sarah	4	administratively they belong to sarah	base	onset_noise_amp0.05_dur0.5	clean	0.5604675319409788	weak_overlap	A few belong to Sikh community.
i m sure there is no doubt on this	4	i m sure there is no doubt on this	base	onset_noise_amp0.05_dur0.5	ru_64pct	0.5405365252468665	weak_overlap	There is no issue.
the type and only species is cirrhoseps pachuchet	4	the type and only species is cirrhoseps pachuchet	base	onset_noise_amp0.05_dur0.5	ru_64pct	0.4142227113253648	novel_or_generic	Young Woolwich is the type and model of a young drummer.
return to the common the sun was setting	4	return to the common the sun was setting	base	onset_noise_amp0.5_dur0.5	ru_64pct	0.3420403590889145	novel_or_generic	After breaking the Banni, these karagas return to the temples.
the city of canada is the largest city in the world	4	the city of canada is the largest city in the world	base	reverb_amp0.5_dur0.5	ru_64pct	0.674248495727903	strong_overlap	Kuopio is the largest city in the region.
pindari river later joins laknanda river at karnapriyag	4	pindari river later joins laknanda river at karnapriyag	base	reverb_amp0.5_dur0.5	ru_64pct	0.49813993763030573	weak_overlap	Licking Creek joins the Clarion River at Callensburg.
this is something i want in paris	4	this is something i want in paris	base	reverb_amp0.5_dur0.5	clean	0.5107603980668817	weak_overlap	This is something we've never had before.
the castillo is a village in navarra	4	the castillo is a village in navarra	base	reverb_amp0.8_dur0.5	clean	0.5776149489791789	weak_overlap	Salvador Do Mundo is a village in Goa.
it just seemed so safe and true	4	it just seemed so safe and true	base	reverb_amp0.8_dur0.5	rr_64pct	0.6005845169929809	weak_overlap	It's just 'It'.
an important person in the life of emilio claus was the painter jimmy montagny	4	an important person in the life of emilio claus was the painter jimmy montagny	rr_64pct	none	rr_64pct	0.40370272502109206	novel_or_generic	An important person in the history of Grayling is Rasmus Hanson.
ross is still generally married and he has no descendants	4	ross is still generally married and he has no descendants	rr_64pct	none	ru_64pct	0.5061605423245947	weak_overlap	He has no education.
abbas was considered a leading writer of the early short story	4	abbas was considered a leading writer of the early short story	rr_64pct	none	ru_64pct	0.3577918600352934	novel_or_generic	It is Grahame's most famous short story.
it s not dilang	4	it s not dilang	rr_64pct	none	clean	0.6767112467224828	strong_overlap	It's not routine practice.
black man life of chess	4	black man life of chess	rr_64pct	none	clean	0.5795034631750184	weak_overlap	And a black man!
we get to walk up to the tower	4	we get to walk up to the tower	rr_64pct	none	clean	0.40756500655717287	novel_or_generic	"He would walk up to ball and ""just do it""."
the area around megalisterna consists mostly of agricultural land	4	the area around megalisterna consists mostly of agricultural land	rr_64pct	none	ru_64pct	0.45699341921009096	weak_overlap	It consists mostly of covers of other musicians' songs.
the town was named after the spanish town for lumbar	4	the town was named after the spanish town for lumbar	rr_64pct	none	ru_64pct	0.6636877314496057	strong_overlap	The town was named after Benjamin Waite, a lumberman.
he is however usually addressed as lord stern or lord stern of brentford	4	he is however usually addressed as lord stern or lord stern of brentford	rr_64pct	none	clean	0.31752489814094287	novel_or_generic	He is generally addressed as Father General.
will schools secondary schools giving a general medical education	4	will schools secondary schools giving a general medical education	rr_64pct	none	rr_64pct	0.3716318922967271	novel_or_generic	There are also ten secondary schools and seventeen pre-school institutions.
william howard was born at hinzburg wermend	4	william howard was born at hinzburg wermend	rr_64pct	none	ru_64pct	0.8099665554708695	strong_overlap	Fossombroni was born at Arezzo.
mia turns seven today	4	mia turns seven today	rr_64pct	none	rr_64pct	0.5017775953262921	weak_overlap	Or seven.
he later become chief pilot and director of flight operations at madsens airlines	4	he later become chief pilot and director of flight operations at madsens airlines	rr_64pct	none	ru_64pct	0.31947654336571507	novel_or_generic	She was later director of human resources and director of strategic planning.
she disdains artorias barbaric practices and thirsts for conquest	4	she disdains artorias barbaric practices and thirsts for conquest	rr_64pct	none	rr_64pct	0.3163182833890862	novel_or_generic	These practices and others, intensified attitudes of segregation and inequality.
plax makes a fine brand of paper	4	plax makes a fine brand of paper	rr_64pct	none	clean	0.38396423497200693	novel_or_generic	The largest brand of Unibrew is Royal.
distil your heart and give away the feet and the arms to god	4	distil your heart and give away the feet and the arms to god	rr_64pct	none	ru_64pct	0.4008457924845684	novel_or_generic	The feet and eyes are yellow.
this failure has led to sixteen powerplants having zero days of cold stop	4	this failure has led to sixteen powerplants having zero days of cold stop	rr_64pct	none	ru_64pct	0.3505762903630453	novel_or_generic	At times, this has led to conflict.
and the current competition is	4	and the current competition is	rr_64pct	onset_noise_amp0.05_dur0.5	clean	0.38763385918827153	novel_or_generic	The addition is repeated, and the current decreases again.
some stones are worth the wreckage	4	some stones are worth the wreckage	rr_64pct	onset_noise_amp0.05_dur0.5	rr_64pct	0.43157801750285874	novel_or_generic	It was worth the trouble.
to err is fun to forgive divine	4	to err is fun to forgive divine	rr_64pct	onset_noise_amp0.05_dur0.5	clean	0.4206976845213648	novel_or_generic	They're incredible fun to drive.
the city is now a city of the city	3	the city is now a city of the city	base	full_noise_amp0.5_dur0.0	ru_64pct	0.4571539727131262	weak_overlap	The centre of the city is Giza Square.
the city is also home to the city of canada and canada canada is the largest city in the world	3	the city is also home to the city of canada and canada canada is the largest city in the world	base	full_noise_amp0.5_dur0.0	ru_64pct	0.49089745838101473	weak_overlap	The city is also home to Wayland Academy, a private school.
the city is located in the southern part of the city center of the city center	3	the city is located in the southern part of the city center of the city center	base	full_noise_amp0.5_dur0.0	ru_64pct	0.5258105844431569	weak_overlap	It is located in the southern part of the county.
the city is located in the southern part of the city center	3	the city is located in the southern part of the city center	base	full_noise_amp0.75_dur0.0	ru_64pct	0.6457404547377491	weak_overlap	It is located in the southern part of the county.
walsh was educated at heverdasher s archambal school	3	walsh was educated at heverdasher s archambal school	base	onset_noise_amp0.05_dur0.5	ru_64pct	0.5750658349768111	weak_overlap	He was educated at Douai School, Woolhampton, Berkshire.
its career underwent has amounted to twenty four to twenty five years in this career	3	its career underwent has amounted to twenty four to twenty five years in this career	base	onset_noise_amp0.05_dur0.5	clean	0.36527803392523506	novel_or_generic	Mozilla was founded twenty-five years ago.
he was the eldest brother of catherine duchess of ghent	3	he was the eldest brother of catherine duchess of ghent	base	onset_noise_amp0.05_dur0.5	ru_64pct	0.42458950666075757	novel_or_generic	He was the eldest of ten siblings.
the cornices of the room were mostly intact but showed signs of damage and damage	3	the cornices of the room were mostly intact but showed signs of damage and damage	base	onset_noise_amp0.05_dur0.5	ru_64pct	0.34678263495809025	novel_or_generic	I noticed around the room our participants were mostly femmes.
an important person in the life of emilio claus was the painter jim montegna	3	an important person in the life of emilio claus was the painter jim montegna	base	onset_noise_amp0.05_dur0.5	rr_64pct	0.40519186728870926	novel_or_generic	An important person in the history of Grayling is Rasmus Hanson.
his most important work was in the field of transformations pioneered by sofasly	3	his most important work was in the field of transformations pioneered by sofasly	base	onset_noise_amp0.05_dur0.5	ru_64pct	0.3675741495148577	novel_or_generic	It is still a key tool in the field of palaeontology.
verasling is a talented farm manager she works in vienna	3	verasling is a talented farm manager she works in vienna	base	onset_noise_amp0.05_dur0.5	ru_64pct	0.45290798966430146	weak_overlap	But predominantly she works in South Indian film industry.
hurs is totally remarried and he has no descendants	3	hurs is totally remarried and he has no descendants	base	onset_noise_amp0.05_dur0.5	ru_64pct	0.5178476938523087	weak_overlap	He has no education.
he is currently a member of investment bank jaffery s global senior advisory board	3	he is currently a member of investment bank jaffery s global senior advisory board	base	onset_noise_amp0.05_dur0.5	ru_64pct	0.4967817096573144	weak_overlap	Mitchell is currently a member of the InterAction Council.
compagno refers to a tendency to stammer	3	compagno refers to a tendency to stammer	base	onset_noise_amp0.05_dur0.5	clean	0.5011676564558439	weak_overlap	That is in their tendency to multiplicity.
abbas was considered a leading writer of the religious stories	3	abbas was considered a leading writer of the religious stories	base	onset_noise_amp0.05_dur0.5	ru_64pct	0.30740917430944803	novel_or_generic	The religious violence gave Thorburn an opportunity.
virginia s name was given in honor of queen victoria of the united kingdom	3	virginia s name was given in honor of queen victoria of the united kingdom	base	onset_noise_amp0.05_dur0.5	clean	0.3540336556080347	novel_or_generic	He was best known at Oxford for his impersonation of Queen Victoria.
amsterdam mathematical centre tracks	3	amsterdam mathematical centre tracks	base	onset_noise_amp0.05_dur0.5	clean	0.3433629921334844	novel_or_generic	This is a mathematical fact!
the series writers included mcgowan danny bradcliffe annie snutter and sean duggan	3	the series writers included mcgowan danny bradcliffe annie snutter and sean duggan	base	onset_noise_amp0.05_dur0.5	ru_64pct	0.23553717294733856	novel_or_generic	Napster was founded by Shawn Fanning, John Fanning, and Sean Parker.
grass nova	3	grass nova	base	onset_noise_amp0.05_dur0.5	ru_64pct	0.32550769658525747	novel_or_generic	I need to mow the grass.
pindari river later joins laknanda river at karnapryag	3	pindari river later joins laknanda river at karnapryag	base	onset_noise_amp0.05_dur0.5	ru_64pct	0.49813993763030573	weak_overlap	Licking Creek joins the Clarion River at Callensburg.
like my life of chess	3	like my life of chess	base	onset_noise_amp0.05_dur0.5	clean	0.4929762225124885	weak_overlap	Life of Agony
city is more clearly visible	3	city is more clearly visible	base	onset_noise_amp0.05_dur0.5	clean	0.34110288953648604	novel_or_generic	Both cases are clearly visible in Iran.
and like most armadillos they are not fossorial but will use abandoned giant and inner burrows	3	and like most armadillos they are not fossorial but will use abandoned giant and inner burrows	base	onset_noise_amp0.05_dur0.5	ru_64pct	0.32267605841975067	novel_or_generic	They are not listed here.
except from the last two the other villages had been physically degraded into the resort	3	except from the last two the other villages had been physically degraded into the resort	base	onset_noise_amp0.05_dur0.5	rr_64pct	0.32837565515377853	novel_or_generic	"The last two variations mean ""snail"" or a ""spiral"" in Spanish."
salman noah	3	salman noah	base	onset_noise_amp0.05_dur0.5	ru_64pct	0.37027844953702616	novel_or_generic	This team was captained by Noah.
the sea has lived on in this shell because that is destiny	3	the sea has lived on in this shell because that is destiny	base	onset_noise_amp0.05_dur0.5	ru_64pct	0.2604347804073611	novel_or_generic	He has lived in Lathrup Village, Michigan.
the area around megalithina consists mostly of agricultural land	3	the area around megalithina consists mostly of agricultural land	base	onset_noise_amp0.05_dur0.5	ru_64pct	0.45699341921009096	weak_overlap	It consists mostly of covers of other musicians' songs.
when the rainforests are depleted we turn the planet into a waste ground	3	when the rainforests are depleted we turn the planet into a waste ground	base	onset_noise_amp0.05_dur0.5	clean	0.24467088682400195	novel_or_generic	In some continuities, he is the planet's only survivor.
from the interchange the expressway goes northeast and south to parallel the chihalas river	3	from the interchange the expressway goes northeast and south to parallel the chihalas river	base	onset_noise_amp0.05_dur0.5	rr_64pct	0.2619086327689528	novel_or_generic	It takes its origin at the interchange with the Rabat-Tangier expressway.
he is however usually dressed as lord sterne or lord sterne of brentford	3	he is however usually dressed as lord sterne or lord sterne of brentford	base	onset_noise_amp0.05_dur0.5	ru_64pct	0.29539645011838556	novel_or_generic	Lord God Almighty!
dowen became a third wife of fellow missionary rao	3	dowen became a third wife of fellow missionary rao	base	onset_noise_amp0.05_dur0.5	ru_64pct	0.415334907187507	novel_or_generic	Their granddaughter was Fulvia, third wife of Mark Antony.
the president is micah walter	3	the president is micah walter	base	onset_noise_amp0.05_dur0.5	clean	0.5815200372411212	weak_overlap	The president is Nicola Bianchini and the manager is Giuliano Sonzogni.
the launch was flawless all systems were core except for the doctor vance experiment	3	the launch was flawless all systems were core except for the doctor vance experiment	base	onset_noise_amp0.05_dur0.5	ru_64pct	0.3059475133019779	novel_or_generic	Denmark received all payments, though always late except for the first.
four centuries after her death welshmen cried out revenge for gwenlyn when engaging in battle	3	four centuries after her death welshmen cried out revenge for gwenlyn when engaging in battle	base	onset_noise_amp0.05_dur0.5	clean	0.30565708135789826	novel_or_generic	I cried out, rising hastily.
everything on earth and he vanished around the corner of the bazaar	3	everything on earth and he vanished around the corner of the bazaar	base	onset_noise_amp0.05_dur0.5	clean	0.37016098720837	novel_or_generic	Round the corner of the manse came Toby.
cardinal truches even suggested that hosius was a candidate for the papacy	3	cardinal truches even suggested that hosius was a candidate for the papacy	base	onset_noise_amp0.05_dur0.5	ru_64pct	0.3477410378643462	novel_or_generic	Genevieve was a suffragette and a candidate for the House of Representatives for Louisiana.
the key concentration camps in total were established across the puppet state	3	the key concentration camps in total were established across the puppet state	base	onset_noise_amp0.05_dur0.5	ru_64pct	0.2481827858116532	novel_or_generic	The tree and the puppet are obviously regarded as equivalent.
william howard was born at hinzburg vermond	3	william howard was born at hinzburg vermond	base	onset_noise_amp0.05_dur0.5	ru_64pct	0.8099665554708695	strong_overlap	Fossombroni was born at Arezzo.
the arrowhead line primarily served to hall water tank from the arrowhead string company	3	the arrowhead line primarily served to hall water tank from the arrowhead string company	base	onset_noise_amp0.05_dur0.5	ru_64pct	0.2076838667982277	novel_or_generic	The company primarily distributes livestreaming software.
the pauls meaning the polish people obtained independence	3	the pauls meaning the polish people obtained independence	base	onset_noise_amp0.05_dur0.5	clean	0.33163347975182234	novel_or_generic	Ewelina Flinta the Polish singer was born here.
the beast found the steel company of canada	3	the beast found the steel company of canada	base	onset_noise_amp0.05_dur0.5	clean	0.37340991162614334	novel_or_generic	It was Beauty killed the Beast.
too bad that he quickly going to forget my name he thought	3	too bad that he quickly going to forget my name he thought	base	onset_noise_amp0.05_dur0.5	clean	0.3280430237550508	novel_or_generic	I think that's too bad.
the resulting company is startech security corporation	3	the resulting company is startech security corporation	base	onset_noise_amp0.05_dur0.5	ru_64pct	0.4102243663973011	novel_or_generic	His production company is Mooncusser Films.
fuji dream airlines has its headquarters in mackinacohora	3	fuji dream airlines has its headquarters in mackinacohora	base	onset_noise_amp0.05_dur0.5	ru_64pct	0.7769652607307841	strong_overlap	Empire Airlines has its headquarters in Hayden.
we can out move for in a brand	3	we can out move for in a brand	base	onset_noise_amp0.05_dur0.5	ru_64pct	0.36706878302425405	novel_or_generic	But I’m committed to finding out everything we can.
sinhar was born in allahabad	3	sinhar was born in allahabad	base	onset_noise_amp0.05_dur0.5	ru_64pct	1.0	exact_or_template_copy	Hamel was born in Stralsund.
