hypothesis_norm	count	example_hypothesis	example_eval_config	example_perturbation	best_train_corpus	best_tfidf_similarity	best_similarity_class	best_train_text
what is your advice sir	3	what is your advice sir	base	onset_noise_amp0.5_dur0.5	clean	0.7825143985340666	strong_overlap	What is your progress?
the council s main office is at cobalt business park in warsand	3	the council s main office is at cobalt business park in warsand	base	onset_noise_amp0.5_dur0.5	rr_64pct	0.4136790086189164	novel_or_generic	Its main office is located in Tokyo.
it can use the same command language	3	it can use the same command language	base	onset_noise_amp0.5_dur0.5	clean	0.5062773279374284	weak_overlap	The two weapons are very similar and can use the same ammunition.
he could not believe a bar was going that far	3	he could not believe a bar was going that far	base	onset_noise_amp0.5_dur0.5	clean	0.576871985033646	weak_overlap	He could not believe her to be encouraging him.
he was also a philanthropist	3	he was also a philanthropist	base	onset_noise_amp0.5_dur0.5	rr_64pct	0.6729966889905233	strong_overlap	He was also particularly unselfish.
they steer hard and give away their feet and arms to god	3	they steer hard and give away their feet and arms to god	base	onset_noise_amp0.5_dur0.5	clean	0.26324812682172305	novel_or_generic	They arise, roll up and stow away their mattresses.
he is also a philanthropist	3	he is also a philanthropist	base	onset_noise_amp0.75_dur0.5	clean	0.5302952122571587	weak_overlap	He is also a tattoo artist.
abbas was considered a leading writer of the religious	3	abbas was considered a leading writer of the religious	base	reverb_amp0.5_dur0.5	ru_64pct	0.32328976331044046	novel_or_generic	The religious violence gave Thorburn an opportunity.
i never seen here before	3	i never seen here before	base	reverb_amp0.5_dur0.5	ru_64pct	0.48095832294289553	weak_overlap	It has never seen service.
rich productions include the hill among the world and big among others	3	rich productions include the hill among the world and big among others	base	reverb_amp0.5_dur0.5	ru_64pct	0.33161412803681534	novel_or_generic	Trade names include Bayrepel and Saltidin among others.
the basketball was too heavy while the basketball bladder was too light	3	the basketball was too heavy while the basketball bladder was too light	base	reverb_amp0.5_dur0.5	ru_64pct	0.29069436956239203	novel_or_generic	He was too clever and cruel.
there are two types of coil levers full coil levers and flip on coil levers	3	there are two types of coil levers full coil levers and flip on coil levers	base	reverb_amp0.5_dur0.5	clean	0.6161673124654489	weak_overlap	There are two types, bashrings and bashplates.
luckily the data couldn t penetrate the bulletproof vest	3	luckily the data couldn t penetrate the bulletproof vest	base	reverb_amp0.8_dur0.5	clean	0.35628593414285414	novel_or_generic	Steroids penetrate the barrier.
let me have this	3	let me have this	base	reverb_amp0.8_dur0.5	clean	0.5306819639229381	weak_overlap	Please let me come in.
the video will go on and on forever	3	the video will go on and on forever	rr_64pct	none	rr_64pct	0.49122586934434864	weak_overlap	Go on and smoke — my mistake!
also with allen park is the relocated tom hollins house	3	also with allen park is the relocated tom hollins house	rr_64pct	none	clean	0.37296277749069984	novel_or_generic	Park is trilingual.
he came driving at a speed totally unfaced by the flap flap flap of the bus lane	3	he came driving at a speed totally unfaced by the flap flap flap of the bus lane	rr_64pct	none	ru_64pct	0.30747000420748616	novel_or_generic	In this case, each iamb is underscored with a flap step.
cooper lake is stoked annually with several species of trout fish	3	cooper lake is stoked annually with several species of trout fish	rr_64pct	none	ru_64pct	0.3647470701850455	novel_or_generic	Where several species of shrike exist together, competition for territories can be intense.
gearbox and transferbox look similar to lancer evolution but still are different	3	gearbox and transferbox look similar to lancer evolution but still are different	rr_64pct	none	clean	0.3240532743868587	novel_or_generic	It is a hydantoin, similar to phenytoin.
salman noir	3	salman noir	rr_64pct	none	ru_64pct	0.3083220865925508	novel_or_generic	Salman Shaikh is the Center's Director.
mozdukeen was officially married three times	3	mozdukeen was officially married three times	rr_64pct	none	clean	0.7722045304715561	strong_overlap	Young married three times.
every search begins with beginner s log	3	every search begins with beginner s log	rr_64pct	none	ru_64pct	0.39747017162755394	novel_or_generic	The play begins with a defender guarding a ballhandler.
machen argue against animal rights in his widely reprinted paper do animals have rights	3	machen argue against animal rights in his widely reprinted paper do animals have rights	rr_64pct	none	clean	0.25553288933196416	novel_or_generic	Favoured lyrical concerns included animal rights, conformity and science fiction.
cardinal truchus even suggested that hosius was a candidate for the papacy	3	cardinal truchus even suggested that hosius was a candidate for the papacy	rr_64pct	none	ru_64pct	0.3477410378643462	novel_or_generic	Genevieve was a suffragette and a candidate for the House of Representatives for Louisiana.
the mixture will produce a chlorine solution of approximately 500 milligrams per liter	3	the mixture will produce a chlorine solution of approximately 500 milligrams per liter	rr_64pct	none	ru_64pct	0.38422089955366256	novel_or_generic	One goat will produce of mohair a year.
the students then participated in simulations	3	the students then participated in simulations	rr_64pct	none	ru_64pct	0.42550404492062266	novel_or_generic	He has participated in triathlons.
the resulting company is stattech security corporation	3	the resulting company is stattech security corporation	rr_64pct	none	ru_64pct	0.4102243663973011	novel_or_generic	His production company is Mooncusser Films.
mr smith and his henchmen arrived soon after and captured the trio	3	mr smith and his henchmen arrived soon after and captured the trio	rr_64pct	none	clean	0.3191550206789959	novel_or_generic	Cassander arrived in Athens soon after and occupied Piraeus.
fuji green airlines has its headquarters in makino hara	3	fuji green airlines has its headquarters in makino hara	rr_64pct	none	clean	0.7392260144799356	strong_overlap	Empire Airlines has its headquarters in Hayden.
he describes his mistress as having geranium scintillated brief and blond hair	3	he describes his mistress as having geranium scintillated brief and blond hair	rr_64pct	none	ru_64pct	0.29446417505150335	novel_or_generic	Letters found on Wenzel implicated Germaine Schneider as his mistress.
the station also serves bands in polytechnic high school to the south	3	the station also serves bands in polytechnic high school to the south	rr_64pct	none	rr_64pct	0.33784573462740464	novel_or_generic	To the south lies Muscat District.
his career underground has been bounded towards twenty four to twenty five years ago	3	his career underground has been bounded towards twenty four to twenty five years ago	rr_64pct	onset_noise_amp0.05_dur0.5	clean	0.6115226979398869	weak_overlap	Mozilla was founded twenty-five years ago.
in spite of this i still believe that there were many landmarks	3	in spite of this i still believe that there were many landmarks	rr_64pct	onset_noise_amp0.05_dur0.5	clean	0.3815177826534074	novel_or_generic	In spite of this, General Wolfe decided to proceed with the attack already underway.
the series writers included mcgovern danny brockless annie snutter and sean duggan	3	the series writers included mcgovern danny brockless annie snutter and sean duggan	rr_64pct	onset_noise_amp0.05_dur0.5	ru_64pct	0.25815877142610943	novel_or_generic	Napster was founded by Shawn Fanning, John Fanning, and Sean Parker.
pindaree river later joins laknanda river at karnapriag	3	pindaree river later joins laknanda river at karnapriag	rr_64pct	onset_noise_amp0.05_dur0.5	ru_64pct	0.49813993763030573	weak_overlap	Licking Creek joins the Clarion River at Callensburg.
the rainforests are depleted and we turn the planet into a waste ground	3	the rainforests are depleted and we turn the planet into a waste ground	rr_64pct	onset_noise_amp0.05_dur0.5	clean	0.24352272088854932	novel_or_generic	In some continuities, he is the planet's only survivor.
the launch was flawless all systems were cool except for doctor van s experiment	3	the launch was flawless all systems were cool except for doctor van s experiment	rr_64pct	onset_noise_amp0.05_dur0.5	ru_64pct	0.24668418668084224	novel_or_generic	The missiles fail to launch, being engulfed on the launch pad.
medieval madness was also included in the arcade game ultra pin	3	medieval madness was also included in the arcade game ultra pin	rr_64pct	onset_noise_amp0.05_dur0.5	clean	0.4175010231969347	novel_or_generic	Batman Forever: The Arcade Game was Acclaim Entertainment's first arcade game.
turpin succeeded in deira samarasikara who saw the university through a period of strong growth	3	turpin succeeded in deira samarasikara who saw the university through a period of strong growth	rr_64pct	onset_noise_amp0.05_dur0.5	clean	0.3724300270536829	novel_or_generic	They usually go through a period of dormancy after flowering.
they knew each other	3	they knew each other	rr_64pct	onset_noise_amp0.5_dur0.5	rr_64pct	0.3800471407642678	novel_or_generic	We seemed to understand each other.
it belongs to the punda community	3	it belongs to the punda community	rr_64pct	onset_noise_amp0.5_dur0.5	rr_64pct	0.8564546715351457	near_copy	It belongs to the nyaya panchayat of Paho.
i will go right after it	3	i will go right after it	rr_64pct	onset_noise_amp0.75_dur0.5	clean	0.44438744534373764	novel_or_generic	Who will go first?
maybe because that wasn t his name	3	maybe because that wasn t his name	rr_64pct	reverb_amp0.5_dur0.5	clean	0.36384449358697923	novel_or_generic	Realtor J. O. Treece lent the town his name.
i was in a soft room	3	i was in a soft room	rr_64pct	reverb_amp0.5_dur0.5	ru_64pct	0.42263555780674156	novel_or_generic	Elizabeth was in agonies.
the following year he was elected as the new president of the united states	3	the following year he was elected as the new president of the united states	ru_64pct	full_noise_amp0.5_dur0.0	rr_64pct	0.4573269521047354	weak_overlap	The following year he emigrated to the United States.
the following year he was promoted to the general secretary of the national assembly	3	the following year he was promoted to the general secretary of the national assembly	ru_64pct	full_noise_amp0.5_dur0.0	ru_64pct	0.5544213369668973	weak_overlap	The following year he was promoted to the rank of lieutenant.
you want to take this outside	3	you want to take this outside	ru_64pct	onset_noise_amp0.5_dur0.5	rr_64pct	0.49766253091285007	weak_overlap	So you want to add a third?
will schools seconded will schools giving a general medical education	3	will schools seconded will schools giving a general medical education	ru_64pct	onset_noise_amp0.5_dur0.5	ru_64pct	0.35155375035681047	novel_or_generic	Lungren favored giving children abstinence only education.
its inhabitants are descendants of lanka chotis ethnic groups	3	its inhabitants are descendants of lanka chotis ethnic groups	ru_64pct	onset_noise_amp0.5_dur0.5	ru_64pct	0.4880285037727281	weak_overlap	"Its inhabitants are called ""Blavets"" or ""Sansavornins""."
the pols meaning the polish people obtained an independence	3	the pols meaning the polish people obtained an independence	ru_64pct	onset_noise_amp0.5_dur0.5	clean	0.3661720376204066	novel_or_generic	Ewelina Flinta the Polish singer was born here.
shinha was born in alahaba	3	shinha was born in alahaba	ru_64pct	onset_noise_amp0.5_dur0.5	clean	1.0	exact_or_template_copy	Sinisgalli was born in Montemurro, Basilicata.
